title,url
Virtuālo sacīkšu kultūra un IndyCar cūcība,https://f1.lv/2020/05/04/virtualo-saciksu-kultura-un-indycar-cuciba/
"Virtuālās sacīkstes – Albons pieveic Leklēru, Indycar skandāls, Nitišs piedalās World...",https://f1.lv/2020/05/03/virtualas-sacikstes-albons-pieveic-lekleru-indycar-skandals-nitiss-piedalas-world-rx-sacensibas/
"Pirms 20 gadiem – diena, kad gandrīz zaudējām Kulthārdu",https://f1.lv/2020/05/02/pirms-20-gadiem-diena-kad-gandriz-zaudejam-kulthardu/
"NASCAR kļūs par ‘restarta pionieriem’, atsākot sezonu 17. maijā",https://f1.lv/2020/05/02/nascar-klus-par-restarta-pionieriem-atsakot-sezonu-17-maija/
Īsi pirms Sennas traģēdijas: gatavojoties 1994.gada Sanmarīno GP startam,https://f1.lv/2020/05/01/isi-pirms-sennas-tragedijas-gatavojoties-1994-gada-sanmarino-gp-startam/
MotoGP pilnībā atceļ trīs Eiropas posmus,https://f1.lv/2020/04/29/motogp-pilniba-atcel-tris-eiropas-posmus/
Cik pelna F1 piloti?,https://f1.lv/2020/04/28/cik-pelna-f1-piloti/
"‘Audi’ pamet DTM čempionātu, paliek vienīgi ‘BMW’",https://f1.lv/2020/04/27/audi-pamet-dtm-cempionatu-paliek-vienigi-bmw/
"Francijas GP atcelts, Silverstonā bez skatītājiem, F1 kalendāra uzmetums gatavs",https://f1.lv/2020/04/27/atcelts-ari-francijas-gp-silverstona-varetu-notikt-divi-posmi-bez-skatitajiem/
"Virtuālās sacīkstes – Noriss uzvar IndyCar, NASCAR fotofinišs, cīņu uzsāk arī...",https://f1.lv/2020/04/27/virtualas-sacikstes-noriss-uzvar-indycar-nascar-fotofiniss-cinu-uzsak-ari-formula-e/
"Čempionāts, kas neizmainīja motorsportu – A1 Grand Prix",https://f1.lv/2020/04/26/cempionats-kas-neizmainija-motorsportu-a1-grand-prix/
‘Ferrari’ un ‘McLaren’ asas diskusijas par budžeta griestu ieviešanu,https://f1.lv/2020/04/24/ferrari-un-mclaren-asas-diskusijas-par-budzeta-griestu-ieviesanu/
Kāpēc eSports kļūst arvien populārāks?,https://f1.lv/2020/04/24/kapec-esports-klust-arvien-popularaks/
"Ziņas īsumā – F1 komandu avanss, ‘McLaren’ līgumi, sacīkstes Imolā",https://f1.lv/2020/04/23/zinas-isuma-f1-komandu-avanss-mclaren-ligumi-sacikstes-imola/
Filmas “A Life of Speed: The Juan Manuel Fangio Story” treileris,https://f1.lv/2020/04/23/filmas-a-life-of-speed-the-juan-manuel-fangio-story-treileris/
Kā mainīsies F1 čempionāts ar samazinātu sacīkšu skaitu?,https://f1.lv/2020/04/22/ka-mainisies-f1-cempionats-ar-samazinatu-saciksu-skaitu/
Sebastians Fetels: Arī ar 10 posmiem kalendārā mums būs pilnvērtīgs F1...,https://f1.lv/2020/04/22/sebastians-fetels-ari-ar-10-posmiem-kalendara-mums-bus-pilnvertigs-f1-cempions/
Elektriskais rallijkross pārcelts vēl vienu gadu vēlāk,https://f1.lv/2020/04/21/elektriskais-rallijkross-parcelts-vel-vienu-gadu-velak/
"Leklerks atkal uzvar virtuālajās F1 sacīkstēs, rallijkrosā Adielsons pieveic Hansenus",https://f1.lv/2020/04/19/leklerks-atkal-uzvar-virtualajas-f1-sacikstes-rallijkrosa-adielsons-pieveic-hansenus/
Stikla lodīšu sacensības – Marbula E Race 1 “Paris”,https://f1.lv/2020/04/19/stikla-lodisu-sacensibas-marbula-e-race-1-paris/
Virtuālo sacīkšu kultūra un IndyCar cūcība,https://f1.lv/2020/05/04/virtualo-saciksu-kultura-un-indycar-cuciba/
"Virtuālās sacīkstes – Albons pieveic Leklēru, Indycar skandāls, Nitišs piedalās World...",https://f1.lv/2020/05/03/virtualas-sacikstes-albons-pieveic-lekleru-indycar-skandals-nitiss-piedalas-world-rx-sacensibas/
"Pirms 20 gadiem – diena, kad gandrīz zaudējām Kulthārdu",https://f1.lv/2020/05/02/pirms-20-gadiem-diena-kad-gandriz-zaudejam-kulthardu/
"NASCAR kļūs par ‘restarta pionieriem’, atsākot sezonu 17. maijā",https://f1.lv/2020/05/02/nascar-klus-par-restarta-pionieriem-atsakot-sezonu-17-maija/
Īsi pirms Sennas traģēdijas: gatavojoties 1994.gada Sanmarīno GP startam,https://f1.lv/2020/05/01/isi-pirms-sennas-tragedijas-gatavojoties-1994-gada-sanmarino-gp-startam/
MotoGP pilnībā atceļ trīs Eiropas posmus,https://f1.lv/2020/04/29/motogp-pilniba-atcel-tris-eiropas-posmus/
Cik pelna F1 piloti?,https://f1.lv/2020/04/28/cik-pelna-f1-piloti/
"‘Audi’ pamet DTM čempionātu, paliek vienīgi ‘BMW’",https://f1.lv/2020/04/27/audi-pamet-dtm-cempionatu-paliek-vienigi-bmw/
"Francijas GP atcelts, Silverstonā bez skatītājiem, F1 kalendāra uzmetums gatavs",https://f1.lv/2020/04/27/atcelts-ari-francijas-gp-silverstona-varetu-notikt-divi-posmi-bez-skatitajiem/
"Virtuālās sacīkstes – Noriss uzvar IndyCar, NASCAR fotofinišs, cīņu uzsāk arī...",https://f1.lv/2020/04/27/virtualas-sacikstes-noriss-uzvar-indycar-nascar-fotofiniss-cinu-uzsak-ari-formula-e/
title,url
Virtuālo sacīkšu kultūra un IndyCar cūcība,https://f1.lv/2020/05/04/virtualo-saciksu-kultura-un-indycar-cuciba/
"Virtuālās sacīkstes – Albons pieveic Leklēru, Indycar skandāls, Nitišs piedalās World...",https://f1.lv/2020/05/03/virtualas-sacikstes-albons-pieveic-lekleru-indycar-skandals-nitiss-piedalas-world-rx-sacensibas/
"Pirms 20 gadiem – diena, kad gandrīz zaudējām Kulthārdu",https://f1.lv/2020/05/02/pirms-20-gadiem-diena-kad-gandriz-zaudejam-kulthardu/
"NASCAR kļūs par ‘restarta pionieriem’, atsākot sezonu 17. maijā",https://f1.lv/2020/05/02/nascar-klus-par-restarta-pionieriem-atsakot-sezonu-17-maija/
Īsi pirms Sennas traģēdijas: gatavojoties 1994.gada Sanmarīno GP startam,https://f1.lv/2020/05/01/isi-pirms-sennas-tragedijas-gatavojoties-1994-gada-sanmarino-gp-startam/
MotoGP pilnībā atceļ trīs Eiropas posmus,https://f1.lv/2020/04/29/motogp-pilniba-atcel-tris-eiropas-posmus/
Cik pelna F1 piloti?,https://f1.lv/2020/04/28/cik-pelna-f1-piloti/
"‘Audi’ pamet DTM čempionātu, paliek vienīgi ‘BMW’",https://f1.lv/2020/04/27/audi-pamet-dtm-cempionatu-paliek-vienigi-bmw/
"Francijas GP atcelts, Silverstonā bez skatītājiem, F1 kalendāra uzmetums gatavs",https://f1.lv/2020/04/27/atcelts-ari-francijas-gp-silverstona-varetu-notikt-divi-posmi-bez-skatitajiem/
"Virtuālās sacīkstes – Noriss uzvar IndyCar, NASCAR fotofinišs, cīņu uzsāk arī...",https://f1.lv/2020/04/27/virtualas-sacikstes-noriss-uzvar-indycar-nascar-fotofiniss-cinu-uzsak-ari-formula-e/
"Čempionāts, kas neizmainīja motorsportu – A1 Grand Prix",https://f1.lv/2020/04/26/cempionats-kas-neizmainija-motorsportu-a1-grand-prix/
‘Ferrari’ un ‘McLaren’ asas diskusijas par budžeta griestu ieviešanu,https://f1.lv/2020/04/24/ferrari-un-mclaren-asas-diskusijas-par-budzeta-griestu-ieviesanu/
Kāpēc eSports kļūst arvien populārāks?,https://f1.lv/2020/04/24/kapec-esports-klust-arvien-popularaks/
"Ziņas īsumā – F1 komandu avanss, ‘McLaren’ līgumi, sacīkstes Imolā",https://f1.lv/2020/04/23/zinas-isuma-f1-komandu-avanss-mclaren-ligumi-sacikstes-imola/
Filmas “A Life of Speed: The Juan Manuel Fangio Story” treileris,https://f1.lv/2020/04/23/filmas-a-life-of-speed-the-juan-manuel-fangio-story-treileris/
Kā mainīsies F1 čempionāts ar samazinātu sacīkšu skaitu?,https://f1.lv/2020/04/22/ka-mainisies-f1-cempionats-ar-samazinatu-saciksu-skaitu/
Sebastians Fetels: Arī ar 10 posmiem kalendārā mums būs pilnvērtīgs F1...,https://f1.lv/2020/04/22/sebastians-fetels-ari-ar-10-posmiem-kalendara-mums-bus-pilnvertigs-f1-cempions/
Elektriskais rallijkross pārcelts vēl vienu gadu vēlāk,https://f1.lv/2020/04/21/elektriskais-rallijkross-parcelts-vel-vienu-gadu-velak/
"Leklerks atkal uzvar virtuālajās F1 sacīkstēs, rallijkrosā Adielsons pieveic Hansenus",https://f1.lv/2020/04/19/leklerks-atkal-uzvar-virtualajas-f1-sacikstes-rallijkrosa-adielsons-pieveic-hansenus/
Stikla lodīšu sacensības – Marbula E Race 1 “Paris”,https://f1.lv/2020/04/19/stikla-lodisu-sacensibas-marbula-e-race-1-paris/
"Volfs pērk ‘Aston Martin’ akcijas, Saincs piedalīsies virtuāla GP, ‘McLaren’ vadītājs...",https://f1.lv/2020/04/18/volfs-perk-aston-martin-akcijas-saincs-piedalisies-virtuala-gp-mclaren-vaditajs-cer-uz-dubultposmiem/
NASCAR vienīgais melnādainais braucējs komentē Larsona rasistiskos izteikumus,https://f1.lv/2020/04/17/nascar-vienigais-melnadainais-braucejs-komente-larsona-rasistiskos-izteikumus/
"Bjanki, Batons, Ēriksons… – Daniels Rikjardo atklāj viņaprāt 5 nenovērtētākos F1...",https://f1.lv/2020/04/15/bjanki-batons-eriksons-daniels-rikjardo-atklaj-vinaprat-5-nenovertetakos-f1-braucejus/
Formula 1 čempionāts pēc krīzes varētu kļūt dzīvotspējīgāks,https://f1.lv/2020/04/15/formula-1-cempionats-pec-krizes-varetu-klut-dzivotspejigaks/
NASCAR braucējs iekuļas nepatikšanās par rasistiska vārda lietošanu virtuālajās sacīkstēs,https://f1.lv/2020/04/14/nascar-braucejs-iekulas-nepatiksanas-par-rasistiska-varda-lietosanu-virtualajas-sacikstes/
Pieminot seru Stirlingu Mosu…,https://f1.lv/2020/04/13/pieminot-seru-stirlingu-mosu/
90 gadu vecumā mūžībā devies izcilais autosportists Stirlings Moss,https://f1.lv/2020/04/12/90-gadu-vecuma-muziba-devies-izcilais-autosportists-stirlings-moss/
Neievērojot 2 metru distancēšanos – ciešākie finiši F1 vēsturē,https://f1.lv/2020/04/12/neieverojot-2-metru-distancesanos-ciesakie-finisi-f1-vesture/
"Ziņas īsumā – Sezonas sākums, ‘Renault’ algas, Formula 1 labdarība",https://f1.lv/2020/04/11/zinas-isuma-sezonas-sakums-renault-algas-formula-1-labdariba/
"F1 īsumā: Algarve un Austrija gatava F1, Gazlī cer uz Franciju,...",https://f1.lv/2020/04/08/f1-isuma-algarve-uz-austrija-gatava-f1-gazli-cer-uz-franciju-zaks-piedava-atcelt-cempionatu/
"Oficiāli pārcelts Kanādas Grand Prix, World RX posms Spa trasē un...",https://f1.lv/2020/04/07/oficiali-parcelts-kanadas-grand-prix-world-rx-posms-spa-trase-un-vel-divi-motogp-posmi/
‘Williams’ un ‘Racing Point’ sūta darbiniekus bezalgas atvaļinājumā un samazina braucēju...,https://f1.lv/2020/04/06/williams-un-racing-point-suta-darbiniekus-bezalgas-atvalinajuma-un-samazina-brauceju-algas/
Leklērs uzvar virtuālajā Austrālijas Grand Prix,https://f1.lv/2020/04/06/leklers-uzvar-virtualaja-australijas-grand-prix/
Ko F1 var mācīties no atkopšanās pēc Otrā pasaules kara?,https://f1.lv/2020/04/04/ko-f1-var-macities-no-atkopsanas-pec-otra-pasaules-kara/
"MotoGP ziņas īsumā – Janones diskvalifikācija, Francijas GP pārcelšana, Doviciozo pārsteigums",https://f1.lv/2020/04/03/motogp-zinas-isuma-janones-diskvalifikacija-francijas-gp-parcelsana-doviciozo-parsteigums/
Bijušajam F1 bosam Eklstonam 89 gadu vecumā būs dēls,https://f1.lv/2020/04/02/bijusajam-f1-bosam-eklstonam-89-gadu-vecuma-bus-dels/
"Mazākas algas ‘McLaren’ komandā, Fetels naudu neuzskata par prioritāti",https://f1.lv/2020/04/02/mazakas-algas-mclaren-komanda-fetels-naudu-neuzskata-par-prioritati/
"Leģendārajam Maikam Heilvudam – 80: Varonība, pareģojums un traģēdija",https://f1.lv/2020/04/02/legendarajam-maikam-heilvudam-80-varoniba-paregojums-un-tragedija/
Jānis Baumanis is back!,https://f1.lv/2020/04/02/janis-baumanis-is-back/
"F1 veic ārkārtas izmaiņas noteikumos, lai pasargātu čempionātu un komandas",https://f1.lv/2020/03/31/f1-veic-arkartas-izmainas-noteikumos-lai-pasargatu-cempionatu-un-komandas/
"COVID-19 konstatēts ‘Mugen’ komandas pilota menedžerim, iespējams Marko Asmeram",https://f1.lv/2020/03/31/covid-19-konstatets-mugen-komandas-pilota-menedzerim-iespejams-marko-asmeram/
Marko vēlējās inficēt visu ‘Red Bull’ komandu ar COVID-19,https://f1.lv/2020/03/30/marko-velejas-inficet-visu-red-bull-komandu-ar-covid-19/
"Eklstons iesaldētu tehniskos noteikumus uz trim gadiem, nevis tikai vienu",https://f1.lv/2020/03/29/eklstons-iesaldetu-tehniskos-noteikumus-uz-trim-gadiem-nevis-tikai-vienu/
Fetels esot noraidījis ‘Ferrari’ piedāvājumu pagarināt līgumu,https://f1.lv/2020/03/29/fetels-esot-noraidijis-ferrari-piedavajumu-pagarinat-ligumu/
"Kā ‘McLaren’ var izmantot krīzi, lai nonāktu galvgalī?",https://f1.lv/2020/03/29/ka-mclaren-var-izmantot-krizi-lai-nonaktu-galvgali/
5 labākās motorsporta spēles,https://f1.lv/2020/03/28/5-labakas-motorsporta-speles/
F1 apsver sezonas noslēgumu janvārī un īsākas nedēļas nogales,https://f1.lv/2020/03/28/f1-apsver-sezonas-noslegumu-janvari-un-isakas-nedelas-nogales/
Eklstons būtu pilnībā atcēlis 2020. gada sezonu,https://f1.lv/2020/03/27/eklstons-butu-pilniba-atcelis-2020-gada-sezonu/
Indianapolisas 500 jūdžu brauciens risināsies vasarā,https://f1.lv/2020/03/26/indianapolisas-500-judzu-brauciens-risinasies-vasara/
Čempionāti turpina pārplānot savus kalendārus,https://f1.lv/2020/03/26/cempionati-turpina-parplanot-savus-kalendarus/
F1LV Podkāsts #65: Jānis Baumanis par jauno līgumu un sezonas mērķiem,https://f1.lv/2020/03/25/f1lv-podkasts-65-janis-baumanis-par-jauno-ligumu-un-sezonas-merkiem/
Jānis Baumanis jaunajā sezonā startēs ar ‘Audi’ un pārstāvēs “JC Raceteknik”...,https://f1.lv/2020/03/25/janis-baumanis-jaunaja-sezona-startes-ar-audi-un-parstaves-jc-raceteknik-komandu/
Kādas bija auto sacīkstes 20.gadsimta sākumā?,https://f1.lv/2020/03/24/kadas-bija-auto-sacikstes-20-gadsimta-sakuma/
"F1 īsumā: gatavošanās Austrijas GP, Fetela nākotne, Norisa ķiveres",https://f1.lv/2020/03/24/f1-isuma-gatavosanas-austrijas-gp-fetela-nakotne-norisa-kiveres/
Oficiāli pārcelts arī Azerbaidžānas Grand Prix,https://f1.lv/2020/03/23/oficiali-parcelts-ari-azerbaidzanas-grand-prix/
"‘Renault’ testpilots Žou uzvar virtuālajā Bahreinas GP, Noriss avarē pēdējā līkumā",https://f1.lv/2020/03/23/renault-testpilots-zou-uzvar-virtualaja-bahreinas-gp-noriss-avare-pedeja-likuma/
Hamiltons atsakas no testa pēc kontakta ar koronavīrusa slimniekiem,https://f1.lv/2020/03/21/hamiltons-atsakas-no-testa-pec-kontakta-ar-koronavirusa-slimniekiem/
"Sennam – 60: Posms, kas padarīja Airtonu par superzvaigzni",https://f1.lv/2020/03/21/sennam-60-posms-kas-padarija-airtonu-par-superzvaigzni/
Atcelts arī Pasaules rallijkrosa čempionāta otrais posms Portugālē,https://f1.lv/2020/03/20/atcelts-ari-pasaules-rallijkrosa-cempionata-otrais-posms-portugale/
"F1 aizvadīs virtuālo čempionātu, pirmais posms jau svētdien ‘Bahreinā’",https://f1.lv/2020/03/20/f1-aizvadis-virtualo-cempionatu-pirmais-posms-jau-svetdien-bahreina/
"Nīderlandes GP rīkotājs pieļauj lielu iespēju, ka sacīkstes Zandvortā šogad vispār...",https://f1.lv/2020/03/20/niderlandes-gp-rikotajs-pielauj-lielu-iespeju-ka-sacikstes-zandvorta-sogad-vispar-nenotiks/
Monako Grand Prix netiks pārcelts uz citu datumu,https://f1.lv/2020/03/19/monako-grand-prix-netiks-parcelts-uz-citu-datumu/
Oficiāli: Jaunie F1 noteikumi stāsies spēkā tikai 2022. gadā,https://f1.lv/2020/03/19/oficiali-jaunie-f1-noteikumi-stasies-speka-tikai-2022-gada/
"F1 sezonu sāks ne ātrāk kā jūnijā – pārceltas sacensības Nīderlandē,...",https://f1.lv/2020/03/19/f1-sezonu-saks-ne-atrak-ka-junija-parceltas-sacensibas-niderlande-spanija-un-monako/
Pārceļ arī tradīcijām bagātās Lemānas 24 stundu sacīkstes,https://f1.lv/2020/03/18/parcel-ari-tradicijam-bagatas-lemanas-24-stundu-sacikstes/
Formula 1 jaunie noteikumi varētu tikt pārcelti uz 2022. gadu,https://f1.lv/2020/03/18/formula-1-jaunie-noteikumi-varetu-tikt-parcelti-uz-2022-gadu/
"Pilota vieta ‘Ferrari’ komandā uz 2021.gadu: Fetels, Rikardo, Džiovinaci",https://f1.lv/2020/03/18/pilota-vieta-ferrari-komanda-uz-2021-gadu-fetels-rikardo-dziovinaci/
"Atcelts Menas salas TT, 6h Spa sacīkstes nenotiks aprīlī, NASCAR turpināsies...",https://f1.lv/2020/03/17/atcelts-menas-salas-tt-6h-spa-sacikstes-nenotiks-aprili-nascar-turpinasies-maija/
IndyCar plāno aizvadīt leģendāro Indy500 sacīksti maijā,https://f1.lv/2020/03/16/indycar-plano-aizvadit-legendaro-indy500-saciksti-maija/
‘Ferrari’ pandēmijas dēļ slēdz savu rūpnīcu Maranello,https://f1.lv/2020/03/15/ferrari-pandemijas-del-sledz-savu-rupnicu-maranello/
Sebastiens Ožjē izcīna sesto uzvaru Meksikas WRC,https://f1.lv/2020/03/15/sebastiens-ozje-izcina-sesto-uzvaru-meksikas-wrc/
Austrālijas GP meklē iespējas noorganizēt sacīkstes vēl šosezon,https://f1.lv/2020/03/14/australijas-gp-mekle-iespejas-noorganizet-sacikstes-vel-sosezon/
Nīderlandes un Spānijas posmu organizatori vēl izvērtē situāciju,https://f1.lv/2020/03/14/niderlandes-un-spanijas-posmu-organizatori-vel-izverte-situaciju/
Debīlisms vispārākajā pakāpē – mantkārīgie centieni noorganizēt Austrālijas GP,https://f1.lv/2020/03/14/debilisms-visparakaja-pakape-mantkarigie-centieni-noorganizet-australijas-gp/
LIVE: Koronavīruss un motorsports – Kas notiek un kas ir atcelts?,https://f1.lv/2020/03/13/koronaviruss-un-motorsports-kas-notiek-un-kas-ir-atcelts/
Pasaules rallijkrosa čempionāta pirmais posms arī pārcelts,https://f1.lv/2020/03/13/pasaules-rallijkrosa-cempionata-pirmais-posms-ari-parcelts/
Oficiāli atcelti arī Bahreinas un Vjetnamas Grand Prix posmi,https://f1.lv/2020/03/13/oficiali-atcelti-ari-bahreinas-un-vjetnamas-grand-prix-posmi/
Formula 1 čempionāta sezona visdrīzāk varētu sākties jūnijā ar Baku sacīksti,https://f1.lv/2020/03/13/formula-1-cempionata-sezona-visdrizak-varetu-sakties-junija-ar-baku-saciksti/
"Austrālijas GP oficiāli atceļ, trīs komandas vēlējās startēt",https://f1.lv/2020/03/13/australijas-gp-oficiali-atcel-tris-komandas-velejas-startet/
Austrālijas Grand Prix šonedēļ nenotikšot,https://f1.lv/2020/03/12/australijas-grand-prix-sonedel-nenotiksot/
‘McLaren’ atsauc savu dalību no Austrālijas Grand Prix,https://f1.lv/2020/03/12/mclaren-atsauc-savu-dalibu-no-australijas-grand-prix/
"Hamiltons un Raikonens nevēlas braukt, Fetels un Rikjardo atbalsta FIA lēmumu",https://f1.lv/2020/03/12/hamiltons-un-raikonens-nevelas-braukt-fetels-un-rikjardo-atbalsta-fia-lemumu/
Ceturto reizi šogad pārceļ MotoGP sezonas pirmo posmu,https://f1.lv/2020/03/11/ceturto-reizi-sogad-parcel-motogp-sezonas-pirmo-posmu/
Izcilais Kristofersons atgriežas pasaules rallijkrosa čempionātā,https://f1.lv/2020/03/11/izcilais-kristofersons-atgriezas-pasaules-rallijkrosa-cempionata/
‘Renault’ Austrālijā parāda patieso jaunā modeļa krāsojumu,https://f1.lv/2020/03/11/renault-australija-parada-patieso-jauna-modela-krasojumu/
Korona vīruss jau ietekmējis Austrālijas GP un Džakartas E-Prix norisi,https://f1.lv/2020/03/11/korona-viruss-jau-ietekmejis-australijas-gp-un-dzakartas-e-prix-norisi/
"Formula E atceļ sacīkstes Indonēzijā, kurām bija jānotiek jūnijā",https://f1.lv/2020/03/11/formula-e-atcel-sacikstes-indonezija-kuram-bija-janotiek-junija/
"MotoGP ASV GP posms pārcelts uz sezonas beigām, sezona varētu sākties...",https://f1.lv/2020/03/10/motogp-asv-gp-posms-parcelts-uz-sezonas-beigam-sezona-saksies-argentina/
Bahreinas GP tiks aizvadīts bez skatītājiem,https://f1.lv/2020/03/08/bahreinas-gp-tiks-aizvadits-bez-skatitajiem/
Formula 1 braucēji atkal varēs mainīt ķiveres pēc sirds patikas,https://f1.lv/2020/03/07/formula-1-brauceji-atkal-vares-mainit-kiveres-pec-sirds-patikas/
Pasaules rallijkrosa čempionāta posms Krievijā tomēr nenotiks,https://f1.lv/2020/03/07/pasaules-rallijkrosa-cempionata-posms-krievija-tomer-nenotiks/
Pārcelts arī Romas e-prix,https://f1.lv/2020/03/06/parcelts-ari-romas-e-prix/
Iepazīsti F1 braucējus – Nikolā Latifi,https://f1.lv/2020/03/05/nikola-latifi/
"Verstapens izbrauc pa Zandvortas trasi, kas šogad atgriežas F1 kalendārā",https://f1.lv/2020/03/04/verstapens-izbrauc-pa-zandvortas-trasi-kas-sogad-atgriezas-f1-kalendara/
Septiņas F1 komandas publicē vienotu preses relīzi par ‘Ferrari’ dzinēju lietu,https://f1.lv/2020/03/04/septinas-f1-komandas-izlaiz-vienotu-preses-relizi-par-ferrari-dzineju-lietu/
Hansens gatavs aizstāvēt titulu un cīnīties ar Kristofersonu,https://f1.lv/2020/03/03/hansens-gatavs-aizstavet-titulu-un-cinities-ar-kristofersonu/
"F1 īsumā: ‘Ferrari’ fokusa maiņa, itāļu problēmas, ‘Williams’ joprojām lēnākie, ‘Racing...",https://f1.lv/2020/03/02/f1-isuma-ferrari-fokusa-maina-italu-problemas-williams-joprojam-lenakie-racing-point-bus-vel-atraki/
"Koronavīruss turpina uzdarboties: pārceļ MotoGP Taizemes GP un Superformula sezonas atklāšanu,...",https://f1.lv/2020/03/02/koronaviruss-turpina-uzdarboties-parcel-motogp-taizemes-gp-un-superformula-sezonas-atklasanu-australijas-gp-notiksot/
Atcelts MotoGP sezonas atklāšanas posms Katarā,https://f1.lv/2020/03/01/motogp-atcel-sezonas-atklasanas-posmu-katara/
"Verņē karantīna Marokā, F2 braucējs koronavīrusa dēļ netiek uz testiem, DTM...",https://f1.lv/2020/02/29/verne-karantina-maroka-f2-braucejs-koronavirusa-del-netiek-uz-testiem-dtm-atcel-testus-monca/
Statistika – Ko mums pavēstīja F1 pirmssezonas testi?,https://f1.lv/2020/02/29/statistika-ko-mums-pavestija-f1-pirmssezonas-testi/
Da Kosta uzvar Marokā un pārņem vadību Formula E kopvērtējumā,https://f1.lv/2020/02/29/da-kosta-uzvar-maroka-un-parnem-vadibu-formula-e-kopvertejuma/
F1 pirmssezonas testi noslēdzas ar Botasu rezultātu tabulas galvgalī,https://f1.lv/2020/02/28/teksta-tiesraide-no-barselonas-f1-testu-otra-cikla-3-diena/
‘Go Karts’ filmas reklāmklipiņš,https://f1.lv/2020/02/27/go-karts-filmas-reklamklipins/
Priekšpēdējā testu dienā Hamiltonam problēmas ar dzinēju,https://f1.lv/2020/02/27/teksta-tiesraide-no-barselonas-f1-testu-otra-cikla-2-diena/
Barselonas testu otro ciklu ar labāko rezultātu atklāj Kubica,https://f1.lv/2020/02/26/teksta-tiesraide-no-barselonas-f1-testu-otra-cikla-1-diena/
Alonso arī šogad piedalīsies Indy 500 sacīkstēs,https://f1.lv/2020/02/25/alonso-ari-sogad-piedalisies-indy-500-sacikstes/
"‘Ferrari’ identificējuši problēmas, izmantos pavēles, bet dos braucējiem vienādas iespējas",https://f1.lv/2020/02/25/ferrari-identificejusi-problemas-izmantos-paveles-bet-dos-braucejiem-vienadas-iespejas/
‘Rebellion Racing’ pieveic ‘Toyota’ ekipāžas 6 stundu sacīkstēs Ostinā,https://f1.lv/2020/02/24/rebellion-racing-pieveic-toyota-ekipazas-6-stundu-sacikstes-ostina/
E-Motorsport 3. posmā uzvaru izcīna Agnis Rozītis,https://f1.lv/2020/02/24/e-motorsport-3-posma-uzvaru-izcina-agnis-rozitis/
Statistika: Barselonas testos ‘Ferrari’ lēnāki par 7 komandām,https://f1.lv/2020/02/22/statistika-barselonas-testos-ferrari-lenaki-par-7-komandam/
"Botass noslēdz pirmo testu ciklu ar Barselonas trases rekordu, 4 reizes...",https://f1.lv/2020/02/21/teksta-tiesraide-formula-1-pirmssezonas-testu-3-diena/
"Markess pagarina līgumu ar ‘Honda’ uz 4 gadiem, MotoGP sacīkstes būs...",https://f1.lv/2020/02/20/markess-pagarina-ligumu-ar-honda-uz-4-gadiem-motogp-sacikstes-bus-redzamas-ari-latvija/
"Raikonens apstājas trasē, taču uzrāda labāko rezultātu otrajā testu dienā",https://f1.lv/2020/02/20/teksta-tiesraide-formula-1-pirmssezonas-testi-2-diena/
"Pirmajā F1 testu dienā ‘Mercedes’ ātrākie, ‘Ferrari’ pārspēj tikai divas komandas",https://f1.lv/2020/02/19/teksta-tiesraide-formula-1-pirmssezonas-testi-1-diena/
Imolas trase gatava aizņemt Šanhajas vietu F1 kalendārā,https://f1.lv/2020/02/18/imolas-trase-gatava-aiznemt-sanhajas-vietu-f1-kalendara/
"Daytona 500 noslēdzas ar smagu līdera avāriju, traumas neesot dzīvībai bīstamas...",https://f1.lv/2020/02/18/daytona-500-nosledzas-ar-smagu-lidera-avariju-traumas-neesot-dzivibai-bistamas-video/
Par ‘Racing Point F1’ komandas titulsponsoru kļūst BWT kompānija,https://f1.lv/2020/02/17/par-racing-point-f1-komandas-titulsponsoru-klust-bwt-kompanija/
‘Netflix’ atrāda ‘Drive to Survive’ otrās sezonas reklāmklipu,https://f1.lv/2020/02/17/netflix-atrada-drive-to-survive-otras-sezonas-reklamklipu/
"‘Williams’ parāda jauno FW43 modeli, kas ieguvis arī sarkanu nokrāsu [Foto]",https://f1.lv/2020/02/17/williams-parada-jauno-fw43-modeli-kas-ieguvis-ari-sarkanu-nokrasu-foto/
Evanss dominē saīsinātajā Zviedrijas WRC,https://f1.lv/2020/02/16/evanss-domine-saisinataja-zviedrijas-wrc/
Vai spēks ir bārdā? ‘Mercedes’ atrāda ‘Botasu 3.0’,https://f1.lv/2020/02/16/vai-speks-ir-barda-mercedes-atrada-botasu-3-0/
Drāma Mehiko ePrix netraucē Evansam izcīnīt uzvaru,https://f1.lv/2020/02/16/drama-mehiko-eprix-netrauce-evansam-izcinit-uzvaru/
"Leklerks sagaida progresu, ‘Renault’ gaida īsto brīdi, ‘Mercedes’ nav gatavi lielām...",https://f1.lv/2020/02/15/leklerks-sagaida-progresu-renault-gaida-isto-bridi-mercedes-nav-gatavi-lielam-izmainam/
‘Alpha Tauri’ jaunā modeļa prezentācija Zalcburgā [FOTO+VIDEO],https://f1.lv/2020/02/14/alpha-tauri-jauna-modela-prezentacijas-tiesraide/
"Sponsori, komandu izveide un unikāla sacensību pieredze digitālā autosporta braucējiem",https://f1.lv/2020/02/14/sponsori-komandu-izveide-un-unikala-sacensibu-pieredze-digitala-autosporta-braucejiem/
‘Alfa Romeo’ izmēģina ‘čūskas ādas’ krāsojuma C39 modeli,https://f1.lv/2020/02/14/alfa-romeo-izmegina-cuskas-adas-krasojuma-c39-modeli/
‘Mercedes’ parāda jauno W11 un aizvada pirmos testus Silverstonā [FOTO+VIDEO],https://f1.lv/2020/02/14/mercedes-parada-jauno-w11-un-aizvadis-pirmos-testus-silverstona/
‘McLaren’ prezentē jauno modeli MCL35 [Foto+Video],https://f1.lv/2020/02/13/mclaren-prezente-jauno-modeli-mcl35/
‘Renault’ prezentācija Parīzē – jaunais modelis vēl nav uzbūvēts,https://f1.lv/2020/02/12/renault/
Korona vīrusa dēļ atcelts Ķīnas GP posms Šanhajā,https://f1.lv/2020/02/12/korona-virusa-del-atcelts-kinas-gp-posms-sanhaja/
"‘Red Bull’ parāda jauno modeli, šodien testi Silverstonā [Foto]",https://f1.lv/2020/02/12/red-bull-parada-jauno-modeli-sodien-testi-silverstona/
Ferrari prezentējuši jauno modeli SF1000 [Video+Foto],https://f1.lv/2020/02/11/live-ferrari-jauna-modela-prezentacijas-tiesraide/
